{
  "$schema": "../docs/fixture-manifest.schema.json",
  "manifestVersion": 1,
  "qualificationProfile": {
    "id": "player-to-labelled-target-v1",
    "description": "Direct selected-player records against a labelled target; duplicate SWING_DAMAGE_LANDED, terminal SPELL_AURA_REMOVED, and dose-only SPELL_AURA_APPLIED_DOSE records are excluded."
  },
  "captures": [
    {
      "id": "boss-encounter",
      "path": "data/boss-encounter.txt",
      "provenance": "real",
      "purposes": [
        "genuine-encounter-envelope",
        "combatant-info",
        "boss-exclusion"
      ],
      "observed": {
        "bytes": 47102,
        "sha256": "891bddac6892288794024bce55db5f30814775fcae01fe41b911d1175f197e78",
        "records": 172,
        "timeRange": {
          "first": "8/14/2026 12:08:52.7962",
          "last": "8/14/2026 12:10:05.5132"
        },
        "version": {
          "logVersion": 22,
          "advancedLoggingEnabled": true,
          "buildVersion": "12.1.0",
          "projectId": 1
        },
        "eventTypes": {
          "COMBAT_LOG_VERSION": 1,
          "COMBATANT_INFO": 2,
          "ENCOUNTER_END": 2,
          "ENCOUNTER_START": 2,
          "MAP_CHANGE": 1,
          "PARTY_KILL": 4,
          "SPELL_AURA_APPLIED": 11,
          "SPELL_AURA_APPLIED_DOSE": 5,
          "SPELL_AURA_REFRESH": 3,
          "SPELL_AURA_REMOVED": 10,
          "SPELL_CAST_FAILED": 4,
          "SPELL_CAST_START": 50,
          "SPELL_CAST_SUCCESS": 53,
          "SPELL_DAMAGE": 3,
          "SPELL_ENERGIZE": 3,
          "SPELL_MISSED": 1,
          "SPELL_SUMMON": 1,
          "SWING_DAMAGE": 2,
          "SWING_DAMAGE_LANDED": 2,
          "SWING_MISSED": 7,
          "UNIT_DIED": 4,
          "ZONE_CHANGE": 1
        }
      },
      "approvedGroundTruth": {
        "playerCharacters": [
          {
            "guid": "Player-3702-0A70D8DF",
            "name": "Pølsefatter-ArgentDawn-EU"
          }
        ],
        "recorderCandidateGuids": ["Player-3702-0A70D8DF"],
        "dummyCandidates": [],
        "encounterEnvelopes": [
          {
            "start": "8/14/2026 12:09:00.7772",
            "end": "8/14/2026 12:09:04.8282",
            "encounterId": 610,
            "name": "Razorgore the Untamed",
            "success": false
          },
          {
            "start": "8/14/2026 12:09:57.5792",
            "end": "8/14/2026 12:09:58.7942",
            "encounterId": 610,
            "name": "Razorgore the Untamed",
            "success": false
          }
        ]
      }
    },
    {
      "id": "cleave-logs",
      "path": "data/cleave-logs.txt",
      "provenance": "real",
      "purposes": ["continuous-multi-target-attempt", "nearby-player-noise"],
      "observed": {
        "bytes": 2290979,
        "sha256": "bd0f2cd5cf4308b3a9f8c5ed3f9dcc33486bc83d288e645b6592c2625eb26638",
        "records": 7462,
        "timeRange": {
          "first": "8/14/2026 12:46:19.2612",
          "last": "8/14/2026 12:48:04.9562"
        },
        "version": {
          "logVersion": 22,
          "advancedLoggingEnabled": true,
          "buildVersion": "12.1.0",
          "projectId": 1
        },
        "eventTypes": {
          "COMBAT_LOG_VERSION": 1,
          "ENVIRONMENTAL_DAMAGE": 1,
          "MAP_CHANGE": 1,
          "SPELL_AURA_APPLIED": 520,
          "SPELL_AURA_APPLIED_DOSE": 622,
          "SPELL_AURA_REFRESH": 985,
          "SPELL_AURA_REMOVED": 421,
          "SPELL_AURA_REMOVED_DOSE": 289,
          "SPELL_CAST_FAILED": 91,
          "SPELL_CAST_START": 37,
          "SPELL_CAST_SUCCESS": 351,
          "SPELL_DAMAGE": 2044,
          "SPELL_ENERGIZE": 836,
          "SPELL_HEAL": 222,
          "SPELL_PERIODIC_DAMAGE": 812,
          "SPELL_SUMMON": 7,
          "SWING_DAMAGE": 110,
          "SWING_DAMAGE_LANDED": 110,
          "UNIT_DIED": 1,
          "ZONE_CHANGE": 1
        }
      },
      "approvedGroundTruth": {
        "playerCharacters": [
          {
            "guid": "Player-3702-092FBB73",
            "name": "Shadowrays-ArgentDawn-EU"
          },
          {
            "guid": "Player-3702-0A6D7AF8",
            "name": "Scorpiôn-ArgentDawn-EU"
          },
          {
            "guid": "Player-3702-0A70D8DF",
            "name": "Pølsefatter-ArgentDawn-EU"
          },
          {
            "guid": "Player-3702-09846A7A",
            "name": "Snausbauss-ArgentDawn-EU"
          },
          {
            "guid": "Player-3702-0AE45F37",
            "name": "Chronomighty-ArgentDawn-EU"
          },
          {
            "guid": "Player-3702-0B5EAD88",
            "name": "Achos-ArgentDawn-EU"
          }
        ],
        "recorderCandidateGuids": ["Player-3702-0A70D8DF"],
        "dummyCandidates": [
          {
            "guid": "Creature-0-1469-0-1615-243208-0001FED3AB",
            "name": "Cleave Training Dummy"
          },
          {
            "guid": "Creature-0-1469-0-1615-243208-00017ED3AB",
            "name": "Cleave Training Dummy"
          },
          {
            "guid": "Creature-0-1469-0-1615-243208-00007ED3AB",
            "name": "Cleave Training Dummy"
          },
          {
            "guid": "Creature-0-1469-0-1615-243208-0000FED3AB",
            "name": "Cleave Training Dummy"
          },
          {
            "guid": "Creature-0-1469-0-1615-243208-00027ED3AB",
            "name": "Cleave Training Dummy"
          }
        ],
        "attempts": [
          {
            "playerGuid": "Player-3702-0A70D8DF",
            "targetGuids": [
              "Creature-0-1469-0-1615-243208-00007ED3AB",
              "Creature-0-1469-0-1615-243208-0000FED3AB",
              "Creature-0-1469-0-1615-243208-00017ED3AB",
              "Creature-0-1469-0-1615-243208-0001FED3AB",
              "Creature-0-1469-0-1615-243208-00027ED3AB"
            ],
            "start": "8/14/2026 12:46:23.3732",
            "end": "8/14/2026 12:47:50.7862",
            "durationMs": 87413,
            "qualifyingRecordCount": 913,
            "maxInternalGapMs": 1974
          }
        ]
      }
    },
    {
      "id": "dummy-encounter",
      "path": "data/dummy-encounter.txt",
      "provenance": "real",
      "purposes": [
        "noisy-single-target-attempt",
        "owned-risen-ghoul",
        "unicode",
        "advanced-fields"
      ],
      "observed": {
        "bytes": 28880428,
        "sha256": "7d157745c171e48dad2926fad3998f08d2b3dc7dd0c616172ece33e57ecd2f35",
        "records": 89921,
        "timeRange": {
          "first": "8/14/2026 11:47:33.8072",
          "last": "8/14/2026 11:56:44.0452"
        },
        "version": {
          "logVersion": 22,
          "advancedLoggingEnabled": true,
          "buildVersion": "12.1.0",
          "projectId": 1
        },
        "eventTypes": {
          "COMBAT_LOG_VERSION": 1,
          "ENVIRONMENTAL_DAMAGE": 2,
          "MAP_CHANGE": 1,
          "SPELL_ABSORBED": 9,
          "SPELL_AURA_APPLIED": 4210,
          "SPELL_AURA_APPLIED_DOSE": 6479,
          "SPELL_AURA_REFRESH": 6545,
          "SPELL_AURA_REMOVED": 3474,
          "SPELL_AURA_REMOVED_DOSE": 2782,
          "SPELL_CAST_FAILED": 954,
          "SPELL_CAST_START": 1328,
          "SPELL_CAST_SUCCESS": 3874,
          "SPELL_DAMAGE": 42159,
          "SPELL_ENERGIZE": 4294,
          "SPELL_HEAL": 933,
          "SPELL_HEAL_ABSORBED": 69,
          "SPELL_MISSED": 18,
          "SPELL_PERIODIC_DAMAGE": 3897,
          "SPELL_PERIODIC_ENERGIZE": 71,
          "SPELL_PERIODIC_HEAL": 313,
          "SPELL_SUMMON": 628,
          "SWING_DAMAGE": 3015,
          "SWING_DAMAGE_LANDED": 4659,
          "SWING_MISSED": 7,
          "UNIT_DIED": 198,
          "ZONE_CHANGE": 1
        }
      },
      "approvedGroundTruth": {
        "playerCharacters": [
          {
            "guid": "Player-3702-0A386116",
            "name": "Plumbster-ArgentDawn-EU"
          },
          {
            "guid": "Player-3702-0628A59A",
            "name": "Eikou-ArgentDawn-EU"
          },
          {
            "guid": "Player-3702-0B4ABFA2",
            "name": "Voidtoast-ArgentDawn-EU"
          },
          {
            "guid": "Player-3702-098E61B7",
            "name": "Manaira-ArgentDawn-EU"
          },
          {
            "guid": "Player-3702-0A70D8DF",
            "name": "Pølsefatter-ArgentDawn-EU"
          },
          {
            "guid": "Player-3702-0ADA6542",
            "name": "Exsanguia-ArgentDawn-EU"
          },
          {
            "guid": "Player-3702-0B19798E",
            "name": "Alustryel-ArgentDawn-EU"
          },
          {
            "guid": "Player-3702-0B554CF5",
            "name": "Vødka-ArgentDawn-EU"
          },
          {
            "guid": "Player-3702-0AD43D87",
            "name": "Greshammer-ArgentDawn-EU"
          },
          {
            "guid": "Player-3702-08C454F2",
            "name": "Warjoy-ArgentDawn-EU"
          },
          {
            "guid": "Player-3702-0B545F27",
            "name": "Blyse-ArgentDawn-EU"
          },
          {
            "guid": "Player-3702-0AFC31A2",
            "name": "Oakenborn-ArgentDawn-EU"
          },
          {
            "guid": "Player-3702-0B5E6E9B",
            "name": "Cursewa-ArgentDawn-EU"
          },
          {
            "guid": "Player-3702-0A3F3B61",
            "name": "Illnath-ArgentDawn-EU"
          },
          {
            "guid": "Player-3702-0B5F5356",
            "name": "Flexxed-ArgentDawn-EU"
          },
          {
            "guid": "Player-3702-0B5F1C20",
            "name": "Blumbee-ArgentDawn-EU"
          },
          {
            "guid": "Player-3702-0A988424",
            "name": "Hanzík-ArgentDawn-EU"
          },
          {
            "guid": "Player-3702-0A91B771",
            "name": "Eruruu-ArgentDawn-EU"
          },
          {
            "guid": "Player-3702-0717CA21",
            "name": "Divinus-ArgentDawn-EU"
          },
          {